{
  "schema_version": "boss-gate/0.3-candidate",
  "workflow_id": "WF-004",
  "risk_tier": "T2",
  "ipos": {
    "input": "evidence_input",
    "process": "evidence_process",
    "output": "evidence_output",
    "storage": "evidence_storage"
  },
  "claim": {
    "asserted_outcome": "SUCCESS",
    "execution_receipt_id": "execution_ok"
  },
  "controls": {
    "retention": {
      "required": true,
      "evidence_id": "retention_missing"
    },
    "minimization": {
      "required": true,
      "evidence_id": "minimization_missing"
    },
    "incident_route": {
      "required": true,
      "evidence_id": "incident_route_ok"
    },
    "specialist": {
      "required": false,
      "evidence_id": null
    }
  },
  "authorization": {
    "approval_request_id": "approval_req_1"
  }
}
